prod_id,cus_id,rev_title,rev_body,rating
B01GGKYKQM,"AHVZCQP5SYIVGZJK4LRP55ZXWETA,AF6YDBL3KYIK3LBKKDIHUMOLKN4Q,AHKL2U5BIK4ZODWORRJ5RWNLL2TQ,AFKZHMXRXMRTVZLMHATTD53AVKRA,AGFTWXF3QWIHMPN7SMTSHB6HNJ7Q,AE4G376L73UNPWICYOSYO2KNXYJA,AHGFA5MNVOFDMIL3322YZ6IOA5VA,AGUR3CFYVZUMDJQIESKOIQOGV7AA","You can trust on this one,The best usb cable,Wel build just like original .,Nice!!,Working perfectly,Basic,Good,No issues","Previously bought amazon basic USB type A cable and i didn't last long, but this USB C product seems manufactured with high quality materials. Supports fast chagrining, data supply etc. just go for it,Exllent,Very satisfied with this purchase, just like orginal quality . Will buy again in future .,My sister is using this cable to charge her phone and the cable is durable and good enough for my sister's phone. Love it!!,I bought it to use Android Auto on Tata Altroz car by connecting to my one plus nord 2T mobile.I have been using this for more than a week now. It's working perfectly..I am happy with the product so far.,Basic,Great product money worth,No issues",4
B0B86CDHL1,"AEOIHOJD3O5MYSVWZOBDUJGYWZGQ,AF6LAYTAGSTBKL2QUF3WFB6OMCPQ,AHKXH7KSF7CPJCJMHB6B35VPTETA,AFELQLNWTS4QJNCCA4ZDTWHVORJQ,AGGE54AKRMX2XMQWQQTSUOPL7CHA,AG7ZAJNX4XZ5LTA4NLWBHTCX2V5A,AGYSVNZMQT5LOVKHSCYDE7OAPKVA,AHAI6EM7F7W3GV3SUIDSKWTBJOSA","It worked well for some days later it is not working , I want it to replace.,Extremely fine,Superb product,This is very decent, quality is super good!,Good,Awesome Product Quantity & Value For Money,Go for it..,Be(a)st in the market.","It worked well for some days later it is not working , I want it to replace.,Nice,Superb product with white lights at both ends when charging. colour and quality feels very premium..,https://m.media-amazon.com/images/I/81u-AB650VL._SY88.jpg,Good,Good Build Quality. Nice Product & Highly Recommended.,Good quality and looks beautiful... I will surely recommend,( After using it for 3 weeks). I use Samsung M51, few months back my USB Cable was torn, so I wasn't able to fast charge. It took a decade to charge from 20-90%. Samsung original cable was too pricey and too flimsy, so I was searching for something durable. While browsing through the product page I was skeptical to place an order, as the company claimed too many features in such a low price. Keeping the negative thoughts aside I ordered it anyhow. The product was delivered well in advance, which made me happy.I unboxed and plugged in the cable, to my surprise the cable delivered everything that the company claimed. The ends have aluminum casing which makes it durable and away from regular wear and tear, it has LED indicator on both ends which turns on when the charger is plugged to the phone. Also, the box that it comes with has a secret code that you need to scratch to reveal which helps to check its authenticity.It easily fast charges my phone in an hour. Overall, I'm very happy with the product.I highly recommend this cable to anyone who needs a fast charging Type C to C cable.Will update this review if any change is observed.",4
B0B5ZF3NRK,"AGE6O2NLNA3NUGORPU4SDK2S23QQ,AEXZDEFVFQ3LW6DKHRGXLPWF63DQ,AHU4FNYTFWSGG5TMN53LED2U7X2Q,AEH463ZLT7U67XS3DWK2Y27GLVWQ,AGOXDFXDUHGRNK5JD2YNYIZ72AEQ,AEDLXBJM6UISEM4SXR6YUIY4KNCQ,AGHUNVKMP4YTSSYUDMEX3JJJ5I3Q,AH5IBUYCUMQE3ZLKBJ3PLWNMXDIQ","Good.,Good product,Ultimate product,Good Product,Not that good. But ok for the price.,Fast cable,Fast charging 👍,Best Alternative to Original Cable","Working well and fast Charing as claimed. Pice is at highside. Good item.,Good working worth of money 💰,It is an awesome cable i got it from Amazon. Do charge my phone in a fast way.,The cable is good in quality and charges fast , got it in good deal in the sale .,It's not a fast charger. It says fast charge but it takes forever to charge. But the wire is strong and durable.,Super fast,Charging very fast👍Good product 👍,Works for both DASH and WARP Charging. Good build quality.",2
B09RFC46VP,"AG6WSLLXZY52HSQUY5PRCXTCYQYQ,AHGJ2DNFP3OJWO73XW2R7TDXI7WA,AGIC6PASSVB4T3KTZHK6ADD23GCA,AH4TEK5IQCC2BSF2KSQNKQEXAPLA,AFJIYRZTBOJBOWYQ5RNA36DBBXOA,AGCRWRS4RJYVGVKINV3VAR4CGDWA,AEGPWBXEAWPF6XRT7EZJOYJQA6DQ,AF5BU6DZ446HN4DTCO7W7AWXBJBA","Worth the price,Mi Smart Tv 32"" :- 7/10 average.,Worth using since 1.5 years,expect more from mi,Worth for money.,Good product,It’s good,Go for it without thinking twice.","Worth the price. I use the local cable providers set up. With my previous tv (Samsung) I was not facing this problem.  The only problem I am facing is each time I turn off the tv from the mains, I have to go to the settings and turn the settings on to tv speaker settings despite no other speaker or WiFi or blue tooth or cell phone being in the proximity. As a result I have stopped turning the tv off from the mains. I just use remote control to put it on stand by. BUT THIS IS A PROBLEM IN THE LONG RUN,,Display is very good. Sound is average iam using soundbar so no issues for me. Don't know how long it will last due to my previous mi 55 4 pro panel gone in 2.5 years. Bought this tv with 2 year warranty on panel.,improve the software response and improve the picture quality. worth for money for this budget (4K).,I have used 2-4 days. Picture quality looks good and impressive. Go for it..Hope long-term quality is also good.,This tv is very good but in this one thing bad is tha this tv some time get stop while playing only YouTube video but otherwise it's a good product,It’s good and value for money,Amazing pic and sound quality. 4K quality at this price. It's really good .",3
B08R69VDHT,"AEGZSNGSJJAEMJ3RRNVZTKUILOHA,AGX46OTZ7C4VDXH4UA7ZAZIZUMYQ,AEDLLY6JXNCVYIW227SBCPVYHNUA,AGTJ44UNO6K5X567YLQPYGN3TV4Q,AFYCBABBI2GCQRSCKIRHPLQNO72A,AG55XGEMTFKS7BXQTNFKHFTMMW5A,AGQYGAK76B74HUWOOUOFTXH2LAZA,AHFHIY2KE5PQIJ6H7PKV6N7OLIZA","Very good product and met my need.  Thanks,Decent value,Nice quality… trustable…,Just well in this price.,supports 2.4 amps fast charging,Nice,Nice.,Value for money","Liked the product.  Accurate to my usb apparatus.,Good value,Till now i had purchased about 20 cables both micro and c type for myself and my family in this last one year. Its all because this brand wins my trust by provinding great quality with reasonable price,na,tested with 2.4 amps charger and phone. gives full 2.4 amps power to phone.the cable LOOKS thick and it has nice texture. despite that, i am sure it is not very durable. the usb connectors are extremely sturdy and they dont bend or flex. the wire will break before the connector does!!warning: usb micro connector has a strong hook. be careful while plugging and unplugging, or you may damage your device.very cheap and usable cable for 120 rs,Super power,Nice product.,In this price this is the best one",3
B09RWZRCP1,"AFJVYK4FXVGRSTSLGVUE5JGB2NVA,AEVJIJSEUXPBRKOQ2PB4JNBUTFRA,AGRLDCPA7VJZZTV4GUIODVQ3DTHA,AEUDATTJUCKFQ5ETVLUU57ZZ3XXQ,AEGR6ZYWXPEZWM7JUEBWQHAOPS2A,AEETOHX32FYDRI6SIAW7L76Q2NHQ,AELSOXQRZBOFSSY4HJUR4Y7ASQBA,AFJ6ALITTDOSUNPSFLRGDVIAEWBQ","Better..!!,Charging speed is not guaranteed!,Exactly as advertised,Excellent warp charge cable,Nice,Amazing cable,Best fast charging cable,Really a good cable, Recommend","Yeap this cable support 65w fast charging tested on my 65w brick of realme 7 pro..Cable and pins quality looks good.Since i couldnt find original cable for 65w charger of realme i was searching for long time for a good one...,Charging speed depends on number of factors and only in best condition it will go above 50 watts and the brand only claims that 65 watts fast charge if only you use the brand's inbox charger . For me personally I tested out at multiple occassion using it for a month or two I never got speed above 38 watt and i tested it with the cable that I received from the box and it also gave me the same speed so buy carefully if you're conditions are good and you get speed more tha 50watss then only you should buy it or you should go with 3A/4A cables as they are cheaper and more durable braided cables,The cable supports fast charging (I'm using a OnePlus 65W charger) as advertised. If it could have been round and braided instead of flat ribbon cable, that would make it more durable. In my experience, braided cables are easy to wrap and store when not in use and they dont get frayed easily. My cable stopped fast charging after two months of usage but warranty support was excellent, I submitted the cable at a nearby centre and a new cable was shipped within 3 days. I've been using Boat Cables for about 6 years now (a cable from a Moto G4 phone is still with me and in use)  and will stick to them.,Got the original one, but there are fake cables being sold, so beware.It warp charges as it supports 6A power supply. The cable is long and sturdy compared to the typical OnePlus cable in the box. The price of original OnePlus cable is 890 mrp but this i got for 400 and is not unlike other third party wires. Definitely worth it. 👍🏻,Best in price segment and durable material tangle free alsi,Amazon send me a used product but the cable is super and support fast charging and the quality is also good but they sent me a used product by others if not it's super product and 3 year's of warranty on it just buy it,Very good quality fast charging cable, getting good quick charging through laptop also.Flat cable design makes it more durable.,I have a OnePlus 7t with 30 Watts charge,My original wire had been destroyed few years ago and was searching for a cable with 6v-5a for fast charging, I had buyed many wires but the phone was not charging as fast as 5he original one. This wire has a good build quality and can do 65 watts (6.5a).",1
B09CMP1SC8,"AHH2TIJJ2IGD5H3DJO3FROUHRRSQ,AF37X7ZH7JPA6H5Q64NV6QFIBCYA,AFKT7LV4XE6XJ2VTHCBHPQECW2RQ,AE7GGDNBOHD2JQ2X5JPD666SAQOQ,AENNAVVG4GBJKDQKJXQUEKQKTXGQ,AFPSO7EYQBYVEJGD4TAT7YFCM6UQ,AFV5W5BR6PKGHPIG3J6TNFK7BSXQ,AHILALAA7Q6SQRTFJVLT75P37FXQ","Good product,Its good, but micro usb doesn't fit my phone.,Good and useful item,It is very best cable,good,2 in 1 Charging Cable.,Sturdy cable overall,Nice & Best Charger Cabel","Product is good , and also it's  strudiness .But no fast charging in this cable , it's normally charging . I love it because it's supported in micro usb , or type c . Over all good .Pros / advantage :- -1) 1.5 meter wire  2) more durable3) supported dual mode type c , micro usbCons / disadvantages:- normal charging , not fast charging,Though it is braided, but it is not strong like boAt. But it's okay to use it. Supports turbocharging.,Working well after months of use. Only thing is that if there is slight pressure, the C -type adapter will come off from the micro usb head. So better to see that the cable is not stretched when using the C type adapter. Otherwise working fine and very convenient for me since i usually have a phone with C type charging and a small Tab with micro USB charging when i travel. I need to carry only one cable now with my powerbank. Will recommend.,Best cable,good,Both Micro USB & Type C mobile connector's are getting charge.Good Decision to purchase this product.,Cable is a good fibre braided with good length.The connector also has a tight fit, sometimes you have to apply a bit force to remove(ig it'll wear off after usage).In comparison, boat has a better quality i would say if u get that in offer as it has metal braided cable and better quality microusb pin.,I like the product bcuz it's help me to charge both phone Type C & Micro Cabel",4
B09YLXYP7Y,"AGU76WKSU62DUNTPCMTC4FCUNRTQ,AEOVR6JEQTAC77BXE5AJMWJGG5PA,AFIFHW5QMFMTWXNZ2JORBMINL3CQ,AG36G3XPHERLKRDG7XYQ2IWJWPIQ,AFEOAY5PB4XEYIOL6DY5WJBOYSKQ,AF2EHSXFZWWS2YEN22DV2ZCJDZZA,AGUFRJ5TPSUUBZBNRWHDRJV4VMQA,AGYEIMSVEDOLA2OV3DIOGX2IMCBA","GOOD,Thank you  Amazon very good charging cable,Good,Very good product,good quality,Very Good Product,This is fast charging USB!,Simply perfect at the price of below 100","Everything is fine but it is bulky and hard, it should be softer and thinner.....,Thank you  Amazon very good charging cable 👍,Good,Good one,quality is good. worth for 150-200 ?. short but durable.,Very Good product . Satisfied..,This is fast charging C pin USB!You can purchase it.,Nice product at price of below 100",3
B09ZPM4C2C,"AFRONQAZPYZARLWLDQM2VXS7ZTIQ,AGA5INGXTDEODK7X55L4WXF6DJNQ,AHTI2CPD7SANQV7GK4FHIKCWJ7VA,AFUYGZVKVTGAEIOV2UCYF5JPXSCA,AHFVYKQ2L4PSG4EKGA4GLQKQT2NA,AENTXYVP4NNTWTHTYFRTOOY2MEAA,AGJS36PNW27URDEUJGCT2OLR3Z6A,AFG6LFTPXXKNHXVGXPDM6P3CCAHA","Good, Value for Money,Picture quality was nice....over all product nice,Till today everything okay,Y,Good,Outstanding Performance,Must buy,Value for money","Everything is good. Just one suggestion, when TCL is giving its own channel, then it should have some content. What it does, it will route me to another OTT platform for which subscription will be required to be taken.,https://m.media-amazon.com/images/I/61mPJN3sH-L._SY88.jpg,I like picture quality, sound,Good,Good,Excellent, very nice.,Almost one month of usage , tv is far better than mi TV. Our 40"" mi horizon edition got complaint 3 times in 2 years of warranty period and finally they didn't replaced, third time display gone  after 2 days of warranty.So never go for mi. TCL picture quality and sound quality is very good. In this price range a must buy product.,Good",2
B0B2DJDCPX,"AEBHZQJ4R2TZ57GOCSTMIP53F4JQ,AHSESHUAGEFQ62M3KYV3EK5K77FQ,AFB3MTOE4VW2XO6RTJGIWJYH5OBQ,AF7CJCAKRIAY4BVN77BTSZYXXIZA,AHW6UBYJXSPOMQVGP74VQ74BO55Q,AGIAEJN4RPI6Z5ABV733VJMBUZLA,AHUELVJPFM3FEIMF2DE7OTNQD5VQ,AHPVTM2FDYB3YW3MXB523JWJTLQA","Value for money,Nice product,timely delivered with good packeging,Good in quality,Quite nice cable,  Go for it,Good product , value for money,Worth buying,Nice","Packing is good .. they have sent a box for itAlso the quality looks good and decently fast chargingGood product for the price paid,Nice product,nice charging cable for low cost.,Highly recommended,Quite nice cable in this price, charging my iPad smoothly  Go for it,I like the product and resnable precise.,Worth buyinh,Nice",2
B0BCZCQTJX,"AEC5PUIW4OSIDDQED7WLXG2S7TOQ,AGVXOHPJT64ZRYKHIDKVJSJGK6CQ,AFQHWSQ7JR7VCM4SWXXIOB4V3VDA,AFXWZKJCBIHCQFOR2RFYUE7UQDSA,AGD7VGYGPRKMQY3XXC4U3XIDF5CQ,AH23AKG5YNJYJ4Y6OYI5H6UBQMLQ,AGKNJPIVMVEHKL6ZFBAQ3CTFZ2KQ,AFR7B35PQ2DLHGMFBSCRIUUVLRWQ","Good Product,Good product for my fire Tv,Over-all food,Good product,Product quality is very good and so is the customer service,It’s good,worth buying,Remote is working fine","Works well on my 4K Amazone fire TV stick as well as 2nd Generation Fire TV Stick.If your original remote is got damaged. Buy this one. But price is a bit high. Should have been available for Rs. 800/-,Liked it and and it suited very well for my fire tv,The representative are very friendly and supportive,Product was good ..Customer service was also good.,It been a month since I started using this product, the product is good but it lags a lot it was the same before but I thought since it is new over time this would get resolved but it’s still the same, it takes time to perform an action most of the times. It not up to the expectation. That is the reason why I am changing the review. Thanks,It works with fire stick lite and to my surprise volume controls are also working which was missing in the original one. Setup is also quick.,working as expected , support is prompt.,This remote is good as expected, shared manual is very simple to follow. I am happy with this product.",4
B07LGT55SJ,"AG3D6O4STAQKAY2UVGEUV46KN35Q,AHMY5CWJMMK5BJRBBSNLYT3ONILA,AHCTC6ULH4XB6YHDY6PCH2R772LQ,AGYHHIERNXKA6P5T7CZLXKVPT7IQ,AG4OGOFWXJZTQ2HKYIOCOY3KXF2Q,AENGU523SXMOS7JPDTW52PNNVWGQ,AEQJHCVTNINBS4FKTBGQRQTGTE5Q,AFC3FFC5PKFF5PMA52S3VCHOZ5FQ","Satisfied,Charging is really fast,Value for money,Product review,Good quality,Good product,Good Product,As of now seems good","Looks durable Charging is fine tooNo complains,Charging is really fast, good product.,Till now satisfied with the quality.,This is a good product . The charging speed is slower than the original iPhone cable,Good quality, would recommend,https://m.media-amazon.com/images/W/WEBP_402378-T2/images/I/81---F1ZgHL._SY88.jpg,Product had worked well till date and was having no issue.Cable is also sturdy enough...Have asked for replacement and company is doing the same...,Value for money",3
B09NKZXMWJ,"AHIKJUDTVJ4T6DV6IUGFYZ5LXMPA,AE55KTFVNXYFD5FPYWP2OUPEYNPQ,AEBWA5I4QFCA3P3OBEPMELBGN4GQ,AHMGAC6QM62UXNEOCZIHLHSXPP2Q,AFHROSCGIXUPV3FYQ7H5QOD46Q7Q,AEAMIR3CMSA32IDEINSJKHRNANTA,AF355FTXYAKFH5NYPRTE7SL3WO3Q,AG5DWPD54QGSLWJ6QUFERLPNAX4Q","Worked on iPhone 7 and didn’t work on XR,Good one,Dull Physical Looks,Just Buy it,Go for it,About the product,Get charging cable at the price,Working well.","Worked on iPhone 7 and didn’t work on iPhone XR,https://m.media-amazon.com/images/W/WEBP_402378-T2/images/I/71qFFAlV9ZL._SY88.jpg,Look-wise, I didn’t like it. Still, I use it for my work.,Product is quite good and is fast charging.Loved it.,I like it . Looks last long.,The sturdiness will depend on the manner of its use. But its speed of charging is great. Very good product for the average income group.,It's great for charging devices with various types of ports. But works best when charging one device at a time.,Good item.",2
B08QX1CC14,"AFZBEV4BOWGRSEH2PK7D65ZW66PA,AFXQ3YGENWMRX36NXEBSR2ROPG5Q,AHD5PGE5RBBE2T3G427T32V7OROA,AELM6ILLTWBSXJXOKMNA2GM3DTKQ,AFXYY4Z4QM34XOLVVYKZSNZGBBBA,AFHZLQ2Q3GSCQCWMF4N66DXXVJCQ,AF62LB4BMTMNZXCHTSXSEKCXZFLQ,AE5KLF5JEOL4PMUGKERILYLPDSNA","Good in this price,Speakers and sound next level,Bad remote,Remote problem,Good quality 👍,Skywall 32 smart TV,Phone se screen chalane fasta hai,YouTube me I'd nhi bana pa raha hun","Overall experience in this price is good.You can change 5 modes of audio.Play Store not support, but their app store has almost all apps, which we uses on tv like Netflix, Prime, YouTube.We can't adjust brightness of tv.,Im giving this review after 6 moths usage,The sound quality was next level,Picture quality also good...,LED is very good but remote is not correct, given bad remote which is not working.,Remote speaker is not. Why? Give me demo for speaker.,Picture quality best and sound,Storage 4GBRam 512MBNot support google playstore,Good,https://m.media-amazon.com/images/I/711DN0Oa2pL._SY88.jpg",3
B0974H97TJ,"AHDJJLKORMH72SSEBWOVAKE66EHA,AHEONKS6KOZ4SIOZNOLYFGQBXU4A,AEUPILALWUFFD34CNWRYX4PFQKSA,AEKWBYGLEXUNRAJKVPO6HMF52W7A,AETM4APJU6TQILR5HKP3CSPYQL5A,AFOGCVLE7W7ZM5OW3XW7JXCNSIVA,AFLFHQMJXDKP4FNRZVNDLBCI7ULA,AGLH5KPYCT4MGPQ34MNWKLR6NXEA","Good Stuff... Recommended!!!,Need better quality,एक मजबूत प्रोडक्ट है,Good,best buy of this cable,Best for,Tough,Nil","Good Stuff... Recommended!!!,Need better quality for changing,Good product,I bought it 7 months. Ago it still working in good condition good 😊,good cable to by in budjet,The cable is of very good quality. Charging speed is good for my Redmi k20 pro which support 27 watt fast charging good thing is that the battery backup improved when charge with this cable I’m really surprise I observed this with many time as I test it with with original cable and result is the same. If this is in ur budget then just buy it don’t hesitate,Reliable, strong,Nil",4
B07GVGTSLN,"AEXK37TSBFHSP2TYE63YPKETWQ7Q,AEKMVX2VDNNX4ZFXI67SGKMJGZAQ,AFEIIEKX6JEHS3CPGCSIYLGCNKFA,AFDYUQAM7Y56P4R5CREI5OBPHSLA,AGEPZSRFODWZ4XUTXO2HNWLJIMJA,AH25HG24NISHLQPFOZA77WS5CUFQ,AFZ7US7H622UBLYL4ZX2XEHT7FHQ,AFDDH5QGUJ2NHJZBIAPEQVUIQCKA","Nice product .,Good quality Braided cable, VFM,Good cord, but has Earthing issue,Ok,Good product. Little bit fast charger for phones like redmi.,Fast charging is working properly,Money value product 👌,Cable a Nice product","Sturdy packing, good product!,Have used this brand cable for my iPhone and iPad before, so when my wife's Samsung charger cable gave up the ghost in less than 6  months, I ordered this. Braided, visibly high quality cable, unlike the flimsy and highly overpriced OEM cables from Apple and Samsung. I have been using my iPhone cable from Wayona for more than 1 1/2 years and still going strong.  Hope this C cable will give a similar performance,I like Wayona chords and especially the long ones. But I get a slight shock - like a static discharge - when I touch my phone while charging with these two cords. Other cords with same charger are okay.,Ok,Cable looks solid and length is also good.Little bit fast charging I observed for phones like Redmi.It also looks solid so I am expecting it to work for atleast 1 year,build quality and fast charging feature,Unbreakable, good quality,Cable a Nice Product",5
B09VCHLSJF,"AGDOVGWZKEQ3M6DA2GHV6WUZT5SA,AGEUXHN7U2Q26CM6TFOTW7GZXFXQ,AHYXZVXUY3QTBP7IBFIUBSZVH2XQ,AGO4OKG6KVBAAE52Q62JBKHRDFFQ,AGOARJLTS744KQC3BTKT5KQVOJUA,AF6XISKAQXTX3Q5RUF2M2VKOJ66A,AEP6PYK2DLTD5UCMURSUNUE4IE5A,AHJSNMHQQWE6LMFRATH5LLJBQQXQ","Decent product. Value for money.,Value for money,Improvements Needed,Everything thing good except the installation experience,Overall taking all aspects TV is good within the price point,Tv installation services,One among the good TVs in the market.,Picture","I am posting this after a few weeks of using the product.Usage: Continuous, OTT only, no Cable/Dish operator.Average daily usage: 6-8 hours.The TV is a great value-for-money product.Installation: The installation was simple and Amazon assisted installation was smooth, timely and hassle-free.Picture: The picture quality is not great when compared with the smoothness of a Sony, LG and Samsung with these kind of specs. Movies and especially hi-res TV series experience was somewhat diluted as most of the times, the output, while in hi-res , wouldn't look like a movie quality which we are used to of watching in the likes of Sony, Samsung LG etc however, with time, you get used to it and only realize the difference when you see the same movie at someone else's better TV.Sound: Sound output is decent. You wouldn't need additional support to enhance the volume as such.Remote: Sleek, sensitive and user-friendly. It's exactly like Amazon's remote.OS: Same as any smart Android TV. Works smoothly without much lags or hiccups. Switching apps from one to another takes a a couple of seconds more than Sony but unless you have used to of those performances, it looks just fine.Standalone and as your first smart TV,  you wouldn't find any reasons to not like the quality and it would like hi-res from the beginning. It is a great value for money product without a doubt.However, if you are considering this as an alternative or second TV after owning the better ones in the past, you will have a hard time adjusting with it.,Picture quality is good for this price, didn’t faced any lag on UI and browsing other apps.",3
