prod_id,cus_id,rev_title,rev_body,rating
B09BW334ML,"AHDC2HUUNEL6GRJRX5TTOVKITONQ,AEBMIYML42WN2LWWZ4VIYP6IYPJA,AGMWSX5A6BMRWUFEIC4KPWXAJ4YQ,AGIBHP2JIWGT67DQJYQTYMAXKTQA,AE53NI5ENHBJCJOCII2GH6FLUOUA,AFI7P52BGRV2NZVRGTJLLCBGJC6Q,AHJ7V4RXBRFQB2OARDFFSNWHNIRQ,AGKCX7P476LO5R2Q3HYVXO2BCSFQ","Nice cover,Good quality,Dealfreez Full Wrap Silicone Remote Cover Case is an excellent product,Remote Cover,Loved it!,Soft,Best product for the price,Look's good",",The rubber around buttons got loose within months.,Dealfreez Full Wrap Silicone Remote Cover Case compatible for 3rd Gen Fire TV Stick is an excellent product,,A great and a must have product..,Good product,Silicon quality is awesom, but price is on bit higher side,It's pretty good but don't know about quality.",4
B082T6GVLJ,"AGD3F3J523RVZPEJGZE7WPFJXONA,AFAKUEWJWYAKREBPXLV2MNKZXMLA,AGM4RYZ46NPKH7I2SDZXAUHSB52A,AHNAIWL3HMBBFWPLJWSHF5XIGJLQ,AELBEUEZY4ZDRRUYDKANK4BUZOHQ,AEVI32AU5HIKNCR3VPGFHSFDOL2Q,AH2YUV5UZMGORXEBW3SJV4N3V2FQ,AHUJ3IACIKHRFAYWD3TAKH3SXKZA","Exchange of the cable,Go for it !!,It works and it is worth,Superab,Works Well and Durable,Very nice product.,Gud product,Stopped working in less than a month","I wanted a long cable but this is short just want to exchange . In one day you cannot judge it,Very nice product it’s surprisingly charge fast then the original one go for it. 🥹🥹✌️✌️,The color is also calming,Very nice,Good product for the price. Works well and charges fast.,Very nice.,Good product.. works fine and good quality product,Last time I bought a cable for 199 and it worked 8 months, this cable looked very fancy and didn't work for one month also.",5
B07DL1KC3H,"AGHKFSJFKP7E3JJOXV3C6UPGZKQA,AFAZO5BDXQFTNM5IUP2X6F5XIIVQ,AFAZO3VRRBIL6DP5UI4B2UDILGRQ,AEBEUDL2VRUKJQ3R52K2SQR5JHJQ,AEYPXWWAKKOQEX2Z6HKEVFCYZ4EA,AHMURR4YBS77BA3QJ43PBIRDLLSA,AFAH6ZDWWYSXCWPETRIORFGRILAA,AGRSOPDTA7U5B4WO5BHUCRZI5KRQ","ভালই কাজ করছে, পয়সা উসুল।,Just what I wanted.. works perfect,Great 👍,Good,Works fine with my Samsung smart TV.,Works perfectly,Not OEM. But works as expected.,Its a good buy works","এই রেপ্লিকা রিমোট সেট টা কাজ করছে। স্যামসাং এলইডি 4 সিরিজের টিভি।,I bought it forMy Samsung E4000 series LED TV. The remote works. I use it mostly to control volume and source and it does its work. Am happy with it.At first they had delivered one remote that didn’t work and then I got a replacement which works as expected. Thank you!,Great 👍,It’s a replica of my old Samsung remote. I have used it for a month now and no issues. Good product.,Works fine with my Samsung smart TV. No issues till now,Does everything the original remote does.,Not a genuine product. Seems brittle and a little tough around the edges. Lighter than original remote probably due to the poorer quality of plastic. But for my usage, that's ok as there are no kids to damage it. I barely use 2-4 buttons in the entire remote (Source switch to HDMI for Chromecast, volume buttons, play and pause).,It works even with older 40 inch Samsung 3D TV with Smart remote one.",3
B0B6F98KJJ,"AHEVOQADJSSRX7DS325HSFLMP7VQ,AG7XYZRCSKX6G2OLO7DVZWIZ3PUQ,AE2THTCCQLBIUSWPF4CPXC6GGP7Q,AHUJZOV34DFEN55QQ5XOYKVKHV6Q,AELX4DI77ZHURZTDLYFU7XMP7R6Q,AE2ODWBBOBD2SITDDIEJ644OSRFQ,AFLW4WXYQ3G6HU5LBQORDDZO3FOQ,AGGRC2P6M43GDEWCAHGYAILCSKTQ","It is the best tv if you are getting it in 10-12k,Good price but the OS lags,GARBAGE QUALITY,Good product.,Good quality,Great experience everything is fantastic 🤠,Super picture quality and sound quality,Awesome","Pros- xiomi 5a is best in budget-Nice picture quality-Very nice audio output- Full of featureCONS- sometimes tv lags-Sometimes stucksIn this prize range all tv having cons like this.::Overall nice tv,The product in this price range is good but as it is running in Android 12 it lags. I hope after few updates the lags problem will be resolved,Useless product and useless quality. Display issues within 7 months and service center is not upto the mark. Go for better brands where quality is assured. I would wish if there was option of negative stars.,Uses as connectes TV the picture is very good. I was hopping a best level of song. Globaly it is a good product.,https://m.media-amazon.com/images/W/WEBP_402378-T2/images/I/61spXDbojZL._SY88.jpg,Greater then ever,Good quality,Good 👍",4
B07JNVF678,"AGKNFVSMZCSEFHPASWFBOIYKRZJA,AERBQW23ELEQZRWXWOW5EFQ2AA7Q,AE6T7WGZSJSYC6C44JF6AJLJDOCA,AFAI5BPCMNB5QLJ2T5WCKGA5U2DQ,AGFEJBFF3L7ZFO3MWAWARDIZZ4QA,AFGPABA7HWGCWXXWZV5QOIOZY77A,AHYITN5O5VRJ4GJVYGJW3W6TRM2A,AG67C3ZJMVIGQPZOJS5PISM3QF6A","Good product,Is worth the money you are paying for it,Good quality cable,Go for it!,Nice product☑️,Good buy,You can trust Wayona,Quality product  , Life of product is good  .","I like the product and I used it for my iphone,The product got delivered fast. It surely does work for the price you pay for it. Does a good work of charging the iPhones without any lags. I will recommend. In fact bought a couple of other products too after taking this cable.,Its build quality is excellent and it charges the phone quickly despite being a long cable which is a good feature of it.,Nice product for rough use. I have been using this in my car since day one & it has taken all the weathering. Good product, zero hassles, zero complaint. Go for it!,Nice product☑️,Good and convenient product for those who don’t want long dangling wires from their power banks😊,I bought a Wayona One Plus cable and then this cable a few years later, never faced an issue. Recommended it to my friends as well, no one faced an issue with Wayona products thus far. Worth it.,Quality product  , Life of product is good  .",2
B09QGZFBPM,"AHL2CPZ63TFC3VB3RUVZVPFC2YZA,AG6X53SP2LB733ON4RXI3T7Y354A,AGR6UE4GCJKWO64UOIRUNFUGTL7A,AEIDO6I6DOUJAKJX6VR6C2PC6ETQ,AGI2Y5SCA6G6LPHLNAJOLCNAMEJQ,AFRCI27IITJW4I7XDL5GNZUQPZTQ,AHVKJVDTF5KCHA5NBPFC7QJAMHJQ,AEAOO4M764H7IQUU3CTHRMQBB4SQ","Good material, fast charging,Costly but good product,Support type c super fast charging,Good quality,Sturdy cable & has decent charging capabilities.,Good buy.,Gud product.,Very good product","Material os very good, initially charges very fast but after 7 months saw a diffrence in speed, I contacted seller for warranty, within 1 day they delivered me new one without any cost.Great product  good service.,Costly but good product,Wire can be a bit soft..it is very hard to get it fold,Product is good but I need replacement asap. Cause it's stopped working.,The cable is physically resilient and looks good too. The cable stopped working in 7 months - contacted customer support and they ensured a replacement soon. All in all, a hassle-free warranty claim.Shall share an update once I get the replacement.,Very sturdy cable, best fit for rough n tough use.,Very nice cable,Very good product",1
B07JGDB5M1,"AG3D6O4STAQKAY2UVGEUV46KN35Q,AHMY5CWJMMK5BJRBBSNLYT3ONILA,AHCTC6ULH4XB6YHDY6PCH2R772LQ,AGYHHIERNXKA6P5T7CZLXKVPT7IQ,AG4OGOFWXJZTQ2HKYIOCOY3KXF2Q,AENGU523SXMOS7JPDTW52PNNVWGQ,AEQJHCVTNINBS4FKTBGQRQTGTE5Q,AFC3FFC5PKFF5PMA52S3VCHOZ5FQ","Satisfied,Charging is really fast,Value for money,Product review,Good quality,Good product,Good Product,As of now seems good","Looks durable Charging is fine tooNo complains,Charging is really fast, good product.,Till now satisfied with the quality.,This is a good product . The charging speed is slower than the original iPhone cable,Good quality, would recommend,https://m.media-amazon.com/images/W/WEBP_402378-T1/images/I/81---F1ZgHL._SY88.jpg,Product had worked well till date and was having no issue.Cable is also sturdy enough...Have asked for replacement and company is doing the same...,Value for money",1
B0981XSZJ7,"AEIFMHDK4ETHLYWSV6TUFNSJU4MQ,AE7BNHD6PZQQD7K3OKFEPFHTISSA,AHPZFIJWLON23LU5RFVBJO4BNM7Q,AEV2GXFIZ3KD7EEKOE5URJQD6IFQ,AGOKXS4TP2M6LTNG5HAEMLCKI2IA,AF5KJPHP55XSZUUXSC5OJUBJ5RVA,AF4TCPZK5Q3JFGYV4MBARJLS54PQ,AH6AGSQLLH54UPSZGMXTOGESIEBQ","No reasons to complain,Value for money,Nice,Works,Value for money,Go For It,Nice,It's fast charging good quality priduct","I bought the original cable for ~1K, and it stopped working after few months.This one is a fraction of cost, and is working well!,Good product for 1+ 6 device. Supports fast charging, charging time identical to original cable.Durability slightly low than original as cable is less flexible. Works perfect with bike/car mobile charger unit as well.,,I've been using it for a month so far, works fine...will update if the dash charging stops working too quick.,Product is Suitable for my Oneplus Nord working in wrap charging mode . Value for money in this price range and quality is also good . Go for it without any doubt for one plus .,Quality... Charging Speed very Good.any Hesitation go for it, Such a good product Might be some minor difference from original but can't be noticed. Try it you wouldn't regret.,Looks sturdy. Time will tell if it's good. Will review after 6 months,Fast charging is the best part than value",5
B0B9XLX8VR,"AHY6AK5LXBTGXDDXSU57ISMDW55Q,AGULFHMPCHCL32WCIP4GEGWFVZEQ,AFVZXMXYRXVM3VBDLGX45W34GQ4Q,AFT4N4FD4G7EYIOZIYP6KBRGU66A","Good TV for the price. (But my experience was not perfect),Good but not best  @!@,Decent tv for the price but misses on basic smart features,Perfect one in our budget. Speedy and customer friendly approach from vu",",Screen quality is good.It's been a month I bought it still working fine.Two main negatives are1• It doesn't have default option to directly start on tata sky tv, we have to select hdmi option from input menu to select tata sky which one is plugged in.2• dosent allow us to command/choose volume up or down from set-top box remote (mine tata sky)We have use tv remove to change the volume setting.Other than that great tv, mine ps4 works fine with it great graphics.Conclusion: If someone ask's me to if they Can buy it or notMine answer will be nor yes nor no.If we you want kinda cheap but decent  quality tv and taking the risk on unknown tv brand on their reliability( just like me ) then go for it.Better then Samsung or Sony ??? Definitely no!!.,I always buy and recommend Samsung Sony or LG for TV. But, I had a hard budget this time and chose Vu because my friends have been using it for at least 4-5 years without much issues.While the delivery and installation were excellent, and TV on the whole is a decent package which gives good clarity than the rival Chinese TVs and Sound, smart features are poor here.You can connect Bluetooth headphones but no option to disconnect them. I had to pair and unpair everytime.There is no voice command button on remote. Even while using the screen button for voice input, nothing gets recognised. My 3k Fire stick voice recognition was tooo good.,I purchased VU gloled 55 inches TV after suggestion from my techie friends and online study. Technician from amazon came to my home for installation in drunken mode. But I compromised with him due to busy schedule of work. He installed tv with his small screws instead of VU standard wall screws. He did whatever he want. Proper installation was not performed.I just calm down then later i gave a complaint to amazon and VU Customer services. Amazon was not properly responded till now. But from VU side i got a huge response of problem solving. Min 3 to 4 customercare executives spoke with me, finally VU's vice President mr prashanth phoned me and apologized me for inconvenience happened to me. He told drunken technician is not from VU. I feel good for VU's Top level executives have interaction with me. From bottom to top level VUs Team in touch with me for a month to resolve my issue due to i stayed away from home. Before few days back technician came to my home again from vu. He reinstalled my tv in perfect position with dedication. I never expect this much customer friendly behaviour from VU Thank you very much VU. Kudos to VU Team...",5
B08Y5KXR6Z,"AEQ2YMXSZWEOHK2EHTNLOS56YTZQ,AGRVINWECNY7323CWFXZYYIZOFTQ,AHBAT6VLOXWGYDL57KHCNCLPXAKA,AF7NDY2H6JVYTSQOZP76GCATQ34Q,AFV7ZA733ZLME4KNLZPMPCBUNPPA,AHFAAPSY2MJ5HYOU2VQDJ7AQY4NQ,AH2WGV2PEBUTICRPBEEVKF24G5LA,AEP4MK3EKOBDKTGPJTRN5RBDIODA","It's pretty good,Average quality,very good and useful usb cable,Good USB cable. My experience was very good it is long lasting,Good,Nice product and useful,-,Sturdy but does not support 33w charging","It's a good product.,Like,Very good item strong and useful USB cableValue for moneyThanks to amazon and producer,https://m.media-amazon.com/images/W/WEBP_402378-T2/images/I/51112ZRE-1L._SY88.jpg,Good,Nice product and useful product,-,Sturdy but does not support 33w charging",2
B09F6VHQXB,"AFCMYWUZMOK6KHPFLL4DTRV2KHWA,AEF55HUCR2L3DMBXVV4SGD55JKIQ,AGOYWHMRBO7PSZ7ZPV3UH243H6AA,AHJFTFOH2F6NXLGSEFSVCLQQLTZA,AG3TB7ROWWPT3OD5SN5ZVSBYZ2NA,AH5MDQC5CNEJHNNNCBFSXIDCO6RQ,AEU4DZ5TUTNBTJHIYUDYHWXTSNSQ,AEVV7FGCQH4N4HDNGHICKQHTMMRA","Good.,Low price & value for money,Value for money,As per price ,product is excellent 👌,The product is great but you might get scammed on Amazon,Very good 👍,Nice tv,Budget free","Middle class family ke liye kafi achha he, ameer log kripya doori banaye rakhen, or galat review dene se bachen.😹😹😹,Sound quality is good 😊😊,Tv is good overallbut croma is not present at some citiesand there the service is worstorelse it good and value for money,Sound quality could be better,Before buying any product from Amazon you should definitely buy products on EMI as you will definitely be cheated by them under the cute name of Free EMI. Amazon is outright cheating by using the word free in their manuals to attract customers. The TV I bought is great .,Picture quality good but sound can be more clear,Nice picture quality,Sometimes lines comes on screen. Can't knew yet what's the problem. Otherwise all is well. Budget free. Happy for product.",5
B0974G5Q2Y,"AFA332YHUPB6I7KMME7SOFX5RKQQ,AH3LHRL5P4YAVOQQCH72G2PJFXSA,AGUUHLF34AIEIOE5KULXXVWKBCMA,AHWY6IG3PXBBJMLVFMHHKM25BVCQ,AEOKB3ECJUM6UQOBFKMEMQVVHL4A,AEYA6LQE25O2P6C7XV62XM3YV2EQ,AHMKSLALVS62JUHSHAI3FUXWDYYA,AFZIZOK5KDBOB5QCHUQRR2ZWUYKA","Just buy it dont even 2nd guess it,Quality is good,Nylon braided quiet sturdy,Amazing,Feels like steel harnessed wire - strong,Sturdy and durable. Useful for charging Power Banks,good,Nice quality","One amazing cable for 300 bucks,Ok with charging. Looks very sturdy and durable.,Fast charging upto 25watts 2m in length and really durable.Bought it like the 4th time passed down my older cables to family members all still in working state.,I bought it in 2019 and it almost last three years post heavy usage... Gonna buy it again! Very good quality,Good quality USB C Charging cable that enables Fast Charging for Samsung M21 as well as M33 5G 24 W seeking phones. 2 metre cable length helpful in keeping phone on desk while Charging Adaptor plugged into Electric Outlet. Best value. Similar 2 m cable costs 3x or 4x in retail market. This is best price,Great product. Wanted this as my Portable battery has USB slot and iPad and Kindle Reader have USB-C ports. Fits my requirement perfectly. Charges very fast.,good,Very good overall",4
B09YL9SN9B,"AE4KODYP3MGRZS2JI6V7ZWVI5CHA,AEEETBDP73H6344UQ5FJSUBNR63A,AEHKKIS4WKMVCADF6Y3HMR5IRM7Q,AHQWAOSKNRUVK7GN5FZJL3UYLV2A,AFJDUYYD5BCY5PU522GYHMVIS4VQ,AFQRUDMIIMRA32Y3JBUQNWFREEUQ,AGSMSIDW4O7QLQGWYZQQMDHWGR4Q,AED3V5KQXHYOPY3IL2CUQITIZFHQ","Good tv and features in this budget.,Genuine products,Offers a lot of functionality for 32 inch,Best Buy under Rs. 16000/-,A perfect TV for your room,Super 👌 👍,Nice,It's amazing with this price 15.5K.","Delivered in time. Package was in good condition, thanks amazon. Was installed within a day. Writing this review after using the tv for more than a week.1. picture quality is good.2. Sound could be better. Dosnt' mean its bad.3. connectivity is good.4. No issues with software or hardware till now.Overall a good product in this budget. Once again thanks Amazon and LG.,This is good smart tv,I wanted to get display for my PS4.  I was contemplating between a monitor and TV.  Since,  there is no need to get display with high resolution, I opted for this TV.  I have been using this TV for 3 months now.  Below are my observations when using this TV as a secondary TV or gaming TV.Pros:1.  This TV comes with the software from the bigger OLED TV of LG meaning,  to some extent better upscaling.2.  Since I am using primarily as a gaming TV, I love the Game mode.  You can truly see the difference when you play with and without Game mode.  Pic and responses are shaper and faster with Game mode active.3.  You can connect Bluetooth headset to TV.  Great when watching movies as a secondary option.4.  LG service is the best!!!  The come probably the next day,  install the TV (wall mount) for free - Really quick and clean.Cons:1.  No headphone Jack on the TV2.  You can connect a Bluetooth headphones to the TV.  However, for gamers,  the game mode is disabled when TV sound output is through headphones.  However, there is a work around for this.,,It is a good product from LG in range of 15k.Pros:1. Bluetooth support for my wireless earphone2. Audio output is enough for room size of 12×12.3. Wall mount installation is free of cost from LG.4. Smart remote in this range is really appreciable from LG. Doubt samsung provide smart remote this in this range.5. Picture quality is decent.,,,I love LG product and happy to buy this product with 15.5K. It's very good smart TV  with amazing features consist of Good processor, Smart Remote,  Good LCD screen and sound quality is also good.Recommended to purchase.",4
B09RX1FK54,"AFJVYK4FXVGRSTSLGVUE5JGB2NVA,AEVJIJSEUXPBRKOQ2PB4JNBUTFRA,AGRLDCPA7VJZZTV4GUIODVQ3DTHA,AEUDATTJUCKFQ5ETVLUU57ZZ3XXQ,AEGR6ZYWXPEZWM7JUEBWQHAOPS2A,AEETOHX32FYDRI6SIAW7L76Q2NHQ,AELSOXQRZBOFSSY4HJUR4Y7ASQBA,AFJ6ALITTDOSUNPSFLRGDVIAEWBQ","Better..!!,Charging speed is not guaranteed!,Exactly as advertised,Excellent warp charge cable,Nice,Amazing cable,Best fast charging cable,Really a good cable, Recommend","Yeap this cable support 65w fast charging tested on my 65w brick of realme 7 pro..Cable and pins quality looks good.Since i couldnt find original cable for 65w charger of realme i was searching for long time for a good one...,Charging speed depends on number of factors and only in best condition it will go above 50 watts and the brand only claims that 65 watts fast charge if only you use the brand's inbox charger . For me personally I tested out at multiple occassion using it for a month or two I never got speed above 38 watt and i tested it with the cable that I received from the box and it also gave me the same speed so buy carefully if you're conditions are good and you get speed more tha 50watss then only you should buy it or you should go with 3A/4A cables as they are cheaper and more durable braided cables,The cable supports fast charging (I'm using a OnePlus 65W charger) as advertised. If it could have been round and braided instead of flat ribbon cable, that would make it more durable. In my experience, braided cables are easy to wrap and store when not in use and they dont get frayed easily. My cable stopped fast charging after two months of usage but warranty support was excellent, I submitted the cable at a nearby centre and a new cable was shipped within 3 days. I've been using Boat Cables for about 6 years now (a cable from a Moto G4 phone is still with me and in use)  and will stick to them.,Got the original one, but there are fake cables being sold, so beware.It warp charges as it supports 6A power supply. The cable is long and sturdy compared to the typical OnePlus cable in the box. The price of original OnePlus cable is 890 mrp but this i got for 400 and is not unlike other third party wires. Definitely worth it. 👍🏻,Best in price segment and durable material tangle free alsi,Amazon send me a used product but the cable is super and support fast charging and the quality is also good but they sent me a used product by others if not it's super product and 3 year's of warranty on it just buy it,Very good quality fast charging cable, getting good quick charging through laptop also.Flat cable design makes it more durable.,I have a OnePlus 7t with 30 Watts charge,My original wire had been destroyed few years ago and was searching for a cable with 6v-5a for fast charging, I had buyed many wires but the phone was not charging as fast as 5he original one. This wire has a good build quality and can do 65 watts (6.5a).",5
B09TT6BFDX,"AG47CSNDLDSLE7BQWBCUPL4IMBZQ,AERVJSFWEB7B63J46ZBDVGL4HEPA,AH7UKBIDDPO4XM2ZIT5IFSGEAIDA,AFVUB7JIZ754R5LHBFCOBLWFL67A,AF2XIRDLVIWFTUBDJMEWJOLB76OA,AFRLBEKPIN22S4K4PBHUJ5PQPI6A,AEMQUDDYUEXPRJ2C64I33YVVSQXA,AFHNMLRH3T77DAFEJ6UUIVBTMB3A","Good,Good,Nice Product,Good looking 👌 good protection for remote control,It's a very good cover..I liked it.,Good,Expensive,Nice","Good product,Good,Nice product, fits exactly.,Good product,Fantastic remote cover to buy. It fits the LG 2022 model's UQ80 as well...A very good product.,Done the job but value high.,Product isn't bad, but the rate is very Expensive.,Nice",3
B09KH58JZR,"AGNRJFR7GTAKNDLEQNVGQMRVURVQ,AGKFJL7J7K55WKEOE2PSU5WEXEAA,AFDHJS4AKUMVMWYEP5HW33C5NQHQ,AHA46ZPX4RCAEYAPE2XW7RQES5IA,AH4LJDHSBLPNJYLQGQ53EQ6DBVZA,AFHWTIWTNOD6HUF5VGHUIVQB3VKA,AGM6RW6V2RSFD5F6ILCN44YX4Y7Q,AHIMDVA5GYWGVLVSZBG3ZFVKF5VA","Fast charging cable,Good product,Don't buy,Excellent design and Material quality,  Amazing Charging speed,it support's fast charging and also support android auto for car,Good type c cable in less price,Fast charging not support,NOT A FAST CHARGING CABLE","It's awesome product. Fast mobile charging cable. I like it.,Good product just wish it was available in black white gets dirty easily.,For a month I had no issues with this, then it started becoming more and more useless. Don't buy it. It looks alright but it is as bad as a local cable. My phone charges slowly, have to disconnect and connect the cables from the ports and reassemble them and still it would reduce the battery. I haven't used a worse cable. Very disappointing and money waste. Also, the packaging was open and not sealed when I recieved it. The seller is a fraud.,Little more grip should be given while plugin out on type-C pin side.so, it can smoothly remove instead of sudden out with little jerk.,first of all it has 'L' shaped port for easy to use while on charge as i'am using it for my car for android auto.over-all its excellent.,https://m.media-amazon.com/images/I/81UCbJvmdmL._SY88.jpg,Realme 6 30W fast charging adapter. Its a slow charging cable vooc not support,Though they call it as fast charging cable, it actually is NOT a fast charging cable.I tried it with my samsung fast charging adapter. Its a slow charging cable, but the look, sturdiness etc are impressive.Planning to return the product.",1
B09DDCQFMT,"AFYFQI7B55R5LXO2D3JPD6FBNUCA,AEE6KWTJSN7EKGJ2TWFZCA6EGWJA,AHTJBJPYGGEWZQWQT7QJT2DPN7ZQ,AG4ZEZKMSPQD52MAAXWEB2PVXJ2Q,AGLKEDKY645GZ33OFGXHPWWFLXOA,AHOTORDSGF2IWSGTMZVAX56B77IQ,AFSEUS2I77MEWPOCPW77EOU6Y62A,AF6SQCFVW3FHWWPMLKQXFO5N2SJQ","Average,As good as original,expensive,Bought it in aug and by oct it is not working.will i get a refund or replacement,A useful compatible product.,Volume button doesn't work at all,Works.,Best Remote,Connect Very Well","Sometimes the remote gets disconnected with the device automatically.,Press home button for 10-20 sec, it is working smoothly like the original.,Not value for money,Not working.not even three months,Value for money.,Submitting after almost 10 days of use. Volume button doesn't work from day 1. Rear battery cover is lose and can fall off anytime. Other functions on the remote like Alexa voice commands, menu, home button, scrolls work fine.,Works fine. Wrong instructions..a bit too expensive. Does the job.,I liked It A Alot,Nyc Remote,Just like Original",5
B08RP2L2NL,"AEZDBVRL3E3S2Q2C7LEY3TTQVVFA,AGASCT5TE6VHAHRFTOBANIS3CEIA,AFHGWFMHIMQWZDC7MDWA55EBUZEQ,AH5QCHOEUTDOJFO6UV2CGMZU5SUQ,AH47N5DDNXGCIUMG3NVONJ6SERZA,AF6N6OWYE2EZASDJCO4BOQD7AFIA,AFET7BHXMVHWJN5AS7AR3VHLW5ZA,AFZL3ATLXN5TG5KBUMLEY2ABSMWA","Good,Not happy with this product.,👍Quality,Not bad,good to charge at home, not in vehicles,Easy to store and use built in quality of plastic roll could have been better,Good,A useful device.","Slow charging, charging speed is not fast,Not happy with this product bcoz this is a highly priced as compared to its quality and the wire is not actually retracted easily. Need to push in byhand.Scrumbles within the case. Not recommended,It doesn't support Apple car play connectivity. Good quality. BUT 👎When winding down the cable most of the times gets entangled.,Usefull,charges, but doesn't support Apple car play,Built in quality of plastic roll could have been better,Useful, 3 types  in one time charging,The device gets tangled easily if you don't reel it in and out with both ends tangential to the housing reel. Otherwise it is a compact and useful device to have in your car.",1
