prod_id,cus_id,rev_title,rev_body,rating
B07JW9H4J1,"AG3D6O4STAQKAY2UVGEUV46KN35Q,AHMY5CWJMMK5BJRBBSNLYT3ONILA,AHCTC6ULH4XB6YHDY6PCH2R772LQ,AGYHHIERNXKA6P5T7CZLXKVPT7IQ,AG4OGOFWXJZTQ2HKYIOCOY3KXF2Q,AENGU523SXMOS7JPDTW52PNNVWGQ,AEQJHCVTNINBS4FKTBGQRQTGTE5Q,AFC3FFC5PKFF5PMA52S3VCHOZ5FQ","Satisfied,Charging is really fast,Value for money,Product review,Good quality,Good product,Good Product,As of now seems good","Looks durable Charging is fine tooNo complains,Charging is really fast, good product.,Till now satisfied with the quality.,This is a good product . The charging speed is slower than the original iPhone cable,Good quality, would recommend,https://m.media-amazon.com/images/W/WEBP_402378-T1/images/I/81---F1ZgHL._SY88.jpg,Product had worked well till date and was having no issue.Cable is also sturdy enough...Have asked for replacement and company is doing the same...,Value for money",2
B098NS6PVG,"AECPFYFQVRUWC3KGNLJIOREFP5LQ,AGYYVPDD7YG7FYNBXNGXZJT525AQ,AHONIZU3ICIEHQIGQ6R2VFRSBXOQ,AFPHD2CRPDZMWMBL7WXRSVYWS5JA,AEZ346GX3HJ4O4XNRPHCNHXQURMQ,AEPSWFPNECKO34PUC7I56ITGXR6Q,AHWVEHR5DYLVFTO2KF3IZATFQSWQ,AH4QT33M55677I7ISQOAKEQWACYQ","A Good Braided Cable for Your Type C Device,Good quality product from ambrane,Super cable,As,Good quality,Good product,its good,Good quality for the price but one issue with my unit","I ordered this cable to connect my phone to Android Auto of car. The cable is really strong and the connection ports are really well made. I already has a Micro USB cable from Ambrane and it's still in good shape. I connected my phone to the car using the cable and it got connected well and no issues. I also connected it to the charging port and yes it has Fast Charging support.,It quality is good at this price and the main thing is that i didn't ever thought that this cable will be so long it's good one and charging power is too good and also supports fast charging,Value for money, with extra length👍,Good, working fine,Product quality is good,Good,very good,Bought for my daughter's old phone.Brand new cable it was not charging, I already repacked and requested for replacement.I checked again, and there was some green colour paste/fungus inside the micro USB connector. I cleaned with an alcoholic and starts working again.Checked the ampere of charging speed got around 1400ma-1500ma - not bad, came with braided 1.5m long cable, pretty impressive for the price.Can't blame the manufacturer.But quality issues by the distributor, they might have stored in very humid place.",5
B096MSW6CT,"AGU3BBQ2V2DDAMOAKGFAWDDQ6QHA,AESFLDV2PT363T2AQLWQOWZ4N3OA,AHTPQRIMGUD4BYR5YIHBH3CCGEFQ,AEUVWXYP5LT7PZLLZENEO2NODPBQ,AHC7MPW55DOO6WNCOQVA2VHOD26A,AFDI6FRPFBTNBG7BAEB7JDJSMKDQ,AFQKCEEEKXCOHTDG4WUN3XPPHJQQ,AHKUUFNMBZIDLSSPA4FEHIO2EC7Q","Good speed for earlier versions,Good Product,Working good,Good for the price,Good,Worth for money,Working nice,it's a really nice product","Not quite durable and sturdy,https://m.media-amazon.com/images/W/WEBP_402378-T1/images/I/71rIggrbUCL._SY88.jpg,Working good,https://m.media-amazon.com/images/W/WEBP_402378-T1/images/I/61bKp9YO6wL._SY88.jpg,Product,Very nice product,Working well,It's a really nice product",5
B08HDJ86NZ,"AEWAZDZZJLQUYVOVGBEUKSLXHQ5A,AG5HTSFRRE6NL3M5SGCUQBP7YSCA,AH725ST5NW2Y4JZPKUNTIJCUK2BA,AHV3TXIFCJPMS4D5JATCEUR266MQ,AGWIGDEMFIIUAOXYY2QATNBSUGHA,AFSTSLQUV4EVEXWKBOLEFHL2H5YQ,AGAKDNBHY2FKX7I4ACRGILU7QL7A,AFNWJUWJRHCC6HN52KMG5AKZY37Q","Good product,Good one,Nice,Really nice product,Very first time change,Good,Fine product but could be better,Very nice it's charging like jet","Good product,long wire,Charges good,Nice,I bought this cable for Rs.339 worthy product for this price, i tested it in various charger adapters 33w and 18w it supports fast charging as well.,Good,Ok,I had got this at good price on sale on Amazon and product is useful with warranty but for warranty you need to go very far not practical for such a cost and mine micro to type c connector stopped working after few days only.,I like this product",2
B08CF3B7N1,"AE3Q6KSUK5P75D5HFYHCRAOLODSA,AFUGIFH5ZAFXRDSZHM4QB2KPKFUQ,AFK4NJOLFSJGWLOJIUIAROJF6YVA,AFUOTYRFUXVPEBGIXVZZ7DR3CZUA,AFDLRSXKDZ6U3U3KD46SQLFGZQRA,AH5VLM66SIK7J3IRG4NY7XVOQ55A,AE3MQNNHHLUHXURL5S7IAR7JTGNQ,AFSEOFZY67MYC7UAJU264Z5NFTLA","As good as original,Decent,Good one for secondary use,Best quality,GOOD,Amazing product at a mind blowing price!,Nice Quality,Good product","Bought this instead of original apple, does the work for 150rs, not as fast as apple charger but its a good option if you want cheap and good product, bought it for iPad pro 10.5 and it's working flawlessly, build quality is ok, its not like i am gonna hang my clothes on it and i want a very strong cable, even a braided cable stop working after a year, i have used both Anker and Apple store strong braided cable they all stop working after a year so please don't buy high end cables just for that instead choose a this one and even if it's stops working withing a year you only loose 150rs compares to 2000rs.UPDATE------------------------------------pin has stopped charging from one side, now i have to slip the pin to charge from other side, but i will update and let know for how long does it work,,It’s good. Not sure about durability as the pin area feels a bit fragile,Does not support apple carplaySo was little disappointed about thatOther than that cable is made up of very good quality,Best to buy,100% NOT FATHFUL,Writing this review post 10 months and 3 orders of the same product.Honestly Portronics Konnect L lightning cable works like magic with the original Apple charging brick.Seeing the price of the cable I initially hesitated buying as it was as low as ?99/- with the offers and so I wasn’t sure if it would work well with my iPhone 12 or whether it would impact my iPhone’s battery health because all the other lightning cable brands were costing over ?350/- like Wayona, Amazon Basics, etc.Earlier I was using Wayona Brand lightning cable with eventually frayed and stopped working.Charging Speed:Charges my iPhone fast enough almost similar compared to the original cable level when used with 12W Original Apple power adapter.Quality and Durability:Great quality braided cable and doesn’t tangle easily and can withstand day-to-day usage.L-Shaped pin:This is very innovative by Portronics and it makes sure the cable doesn’t get damaged even if used while charging.CarPlay and Data Sync:Works smoothly with CarPlay and syncs data effortlessly.PS: I have used this cable only with the Original Apple Charging Brick and extremely satisfied with its performance.,Better than I expect the product I like that Quality and I plan to buy same type cable come with usb C to Lighting cable for emergency purpose that much I love this cable. Buy for this cable only emergency uses only since Good one,Good product and value for money",5
B08Y1TFSP6,"AEQ2YMXSZWEOHK2EHTNLOS56YTZQ,AGRVINWECNY7323CWFXZYYIZOFTQ,AHBAT6VLOXWGYDL57KHCNCLPXAKA,AF7NDY2H6JVYTSQOZP76GCATQ34Q,AFV7ZA733ZLME4KNLZPMPCBUNPPA,AHFAAPSY2MJ5HYOU2VQDJ7AQY4NQ,AH2WGV2PEBUTICRPBEEVKF24G5LA,AEP4MK3EKOBDKTGPJTRN5RBDIODA","It's pretty good,Average quality,very good and useful usb cable,Good USB cable. My experience was very good it is long lasting,Good,Nice product and useful,-,Sturdy but does not support 33w charging","It's a good product.,Like,Very good item strong and useful USB cableValue for moneyThanks to amazon and producer,https://m.media-amazon.com/images/I/51112ZRE-1L._SY88.jpg,Good,Nice product and useful product,-,Sturdy but does not support 33w charging",3
B08WRWPM22,"AG7C6DAADCTRQJG2BRS3RIKDT52Q,AFU7BOMPVJ7Q3TTA4G67RASTGYIQ,AER5ZGIXXVYG3AWZTRZT7M2BYCEA,AHE76XQSOLGOP5ZEKTIW6KUPDWBQ,AGXTMB2XHZBEWZ2UIX7ODZ4XTU6Q,AHNM2XVU745EDPNGUOAG74PTSNRA,AH5RWQ4S72IVLZD6O75OPCFIVDXQ,AG322TYKVPLPBDXE7ABEUK5QTALQ","Long durable.,good,Does not charge Lenovo m8 tab,Best charging cable,good,Boat,Product was good,1.5 m का केबल मेरे लिए बहुत ही लाभदायक है ।","Build quality is good and it is comes with 2 year warranty.,Good Product,Bought it for charging my mobile & tab but it doesn't work for Lenovo m8 tab,Guys this cable is is best compare of everyone over heat protection, quickly charging, but chance to shock circuit,good,Nice,Good quality,1.5एम का डाटा केबल मेरे लिए बहुत ही लाभदायक है ।  मैं इस केबल को लाइन में चार्ज करते समय फोन बहुत आराम से उपयोग  कर पा रहा हु । आप इस केबल से 15watt का  चार्जर उसे कर सकते है (इससे जड़ा नही) । लोकल बाजार में इसका दाम 150 है ,  अमेजन पे ये केबल मुझे 67 में मिला । गर्व से कहो हम हिंदू है , जय हिंद जय भारत ,",2
B08DDRGWTJ,"AHW6E5LQ2BDYOIVLAJGDH45J5V5Q,AF74RSGCHPZITVFSZN76K6GKPICA,AHDD7ZNB47QA2JLYU53HD4ML3VNQ,AHV3ELGDSOWBYUQLXSPDCSHBQRHQ,AEJU4L3ZM2GTILSJZZSNSF6VUOIA,AFVD66VQMSHPDT3A6HBBBGKRXBZA,AELKHQXVSSG6NHXLFJLLNEFRQQUQ,AGYSMAC6V6RFJJOHG2FIRPOZ6CSQ","Worth for money - suitable for Android auto,Good Product,Length,Nice,Original,Very good quay Cable support fast charging.,Original MI cable for charging upto 33 watt,I am veri happy with this product as it provide turbo charging.","Worth for money - suitable for Android auto... my purpose served in car....got it for Rs.150,Everything is Okay. But packaging is not good feeling like seller gave is used cable.,Good product,Good product but cost is more.,Original cable,I bought this cable at 129. Using this cable for Android auto in my car. Perfectly works without any glitch.,Original MI cable. Will charge upto 33 watts. Got it for Rs 150.  I have 67 watt charger and I want a cable for my car so I went for it. I checked the performance with battery charging app. The charging speed is exactly half of my 67 watt original cable. Go for it.,It provided me turbo charging. I recommend for all Redmi note 10s mobile phones. As it provide turbo charging. I am veri happy with this product.",4
B008IFXQFU,"AGV3IEFANZCKECFGUM42MRH5FNOA,AEBO7NWCNXKT4AESAN443HQH35FQ,AE7GD3VRRYQEAHDR7FXJIR23INYA,AHPAW24BI5X2GCX5M2LHI72VSJJQ,AE2VXY4CFO36MDSIMPG43XHNF4GA,AHHQEKUNVETALN7DTRHUQ2WAWEKQ,AFMIFTNTUD5PIHGONWOTRMMZ5EBA,AHOJBIZVVIIFJKRREY4B6ESVA4KA","Works on linux for me. Get the model with antenna.,Does what it say but other brands available at lesser price,Easy Handle,Great product,Perfect working,Speed is perfect,Great Design, Build, Connectivity Range, Packaging and other features but no linux support since v2,Very good","I use this to connect an old PC to internet. I tried lubuntu 20 and ubuntu 22, it worked out of the box in both, didn't have to do any setup. There's an extender cable so you can place this in a comfortable place. Get the model with antenna because otherwise you'll have range problems if you're not directly in line of sight from your wifi router.,The wifi dongle is a simple plug & play device, will start catching available networks right after you plug it into your USB port, no additional installations/ softwares requires. ",2
B082LZGK39,"AECPFYFQVRUWC3KGNLJIOREFP5LQ,AGYYVPDD7YG7FYNBXNGXZJT525AQ,AHONIZU3ICIEHQIGQ6R2VFRSBXOQ,AFPHD2CRPDZMWMBL7WXRSVYWS5JA,AEZ346GX3HJ4O4XNRPHCNHXQURMQ,AEPSWFPNECKO34PUC7I56ITGXR6Q,AHWVEHR5DYLVFTO2KF3IZATFQSWQ,AH4QT33M55677I7ISQOAKEQWACYQ","A Good Braided Cable for Your Type C Device,Good quality product from ambrane,Super cable,As,Good quality,Good product,its good,Good quality for the price but one issue with my unit","I ordered this cable to connect my phone to Android Auto of car. The cable is really strong and the connection ports are really well made. I already has a Micro USB cable from Ambrane and it's still in good shape. I connected my phone to the car using the cable and it got connected well and no issues. I also connected it to the charging port and yes it has Fast Charging support.,It quality is good at this price and the main thing is that i didn't ever thought that this cable will be so long it's good one and charging power is too good and also supports fast charging,Value for money, with extra length👍,Good, working fine,Product quality is good,Good,very good,Bought for my daughter's old phone.Brand new cable it was not charging, I already repacked and requested for replacement.I checked again, and there was some green colour paste/fungus inside the micro USB connector. I cleaned with an alcoholic and starts working again.Checked the ampere of charging speed got around 1400ma-1500ma - not bad, came with braided 1.5m long cable, pretty impressive for the price.Can't blame the manufacturer.But quality issues by the distributor, they might have stored in very humid place.",1
B08CF3D7QR,"AGYLPKPZHVYKKZHOTHCTYVEDAJ4A,AGTTU64JMX722LYCN3SOWLFPKPAQ,AFWD4ZTM7473CDWARHCDQKK73MTA,AEXCQM3FDLX3YL3UJWWUIAIUJT4A,AHUKYUWRUVRTB3IQGISXWTSPAWLQ,AFWW4UEXAJH7EAB5LTMKMSGLUN2Q,AFM5JL37WY7G6MLQUI4WAXUJME7Q,AFECO24WYFOU2KL7C3DMHTEHRU7Q","Good for fast charge but not for data transfer,Good cable compares to local the brand.,good but doesnt last,Good product,Good Product,Good and worth it,very good material quality charging speed is 15 watt,Not a fast charger","The cable is efficient in fast charging but in quick data transfer. Overall fine.,I like the usb c  L shape. Nylon Shielded core wire it improves the life of the cable.,i think i buy these every 6 months or so. fast charging stops working after a while. probbly something to do with the cable design. the cable gets twisted over time and I suspect that breaks the high capacity wires inside. but i keep buying it because there arent too many options in an L shaped design,Good and durable product. Sometime the charges doesn't work on few adapters. there might be few cut off or something but works fine on apple adapter, Car charger, USB,The product is really good at affordable price.,Good and fast charging, and value for money,பொருள் உடைய கடினத்தன்மையின் நன்றாக உள்ளது சார்ஜ் ஏறும் வேகம் 15wat,Not a fast charger.  Very slow charging with 65w.  L-shape pin is very useful.",4
B0789LZTCJ,"AEWAZDZZJLQUYVOVGBEUKSLXHQ5A,AG5HTSFRRE6NL3M5SGCUQBP7YSCA,AH725ST5NW2Y4JZPKUNTIJCUK2BA,AHV3TXIFCJPMS4D5JATCEUR266MQ,AGWIGDEMFIIUAOXYY2QATNBSUGHA,AFSTSLQUV4EVEXWKBOLEFHL2H5YQ,AGAKDNBHY2FKX7I4ACRGILU7QL7A,AFNWJUWJRHCC6HN52KMG5AKZY37Q","Good product,Good one,Nice,Really nice product,Very first time change,Good,Fine product but could be better,Very nice it's charging like jet","Good product,long wire,Charges good,Nice,I bought this cable for Rs.339 worthy product for this price, i tested it in various charger adapters 33w and 18w it supports fast charging as well.,Good,Ok,I had got this at good price on sale on Amazon and product is useful with warranty but for warranty you need to go very far not practical for such a cost and mine micro to type c connector stopped working after few days only.,I like this product",1
B07KSMBL2H,"AEYJ5I6JZZPOJB6MGWRQOHRQLPSQ,AFY5TVFOMVHGBPBTIJODYDQRZM5Q,AE3O6366WGEQAANKJ76QETTUQQTQ,AEQIJCPWSBCDKUO5VROXXHWX3PPA,AGVIAQK2HQ47P7UVXHW2NBAEU7YQ,AE3D5CJ2GDUP5SQ3AAYMVAGDTX7A,AH77IQRYD54XCRMCO7XEAIAYCLPA,AEA2HQHMFG3ZGJFOLLJQ65WKIZUQ","It's quite good and value for money,Works well,Hdmi cable,Value for money,All good,Gets the job done,Delivery was good,This one was my need to purchase","I am using it for 14 days now. The experience is pretty good as of now. Picture quality is also not bad. Don't expect something out of the world at this price point. But you can go for it if you have a tight budget.,Initial impressions: works as said, glad I didn’t go for cheaper options (not that it’s too costly) just plug and play. Will update if it screws up,The hdmi cable is good to watch movie,sports and its gives better quality while connecting your laptop with TV and play 🎮.I loved it,Works as expected. Length of the cable is short and it was mentioned also satisfied my requirement. If you need more length better look other options.,All good,It's the best HDMI cable at this price range. No problems yet. Just go for it !!,I was expecting this to be delivered on time and it was delivered on time.Product is good as i have tried other cables and wires from Amazon basica brand.,Good one",1
B085DTN6R2,"AGUAYQHARAKR2VZTRP276KAGETKQ,AFKTST2773VUOKUHE7FCR6QCAURQ,AEGLHOQOWUUUQEDV6EWXTSHIUE7A,AEHQYGI5L4FFALBMC5XMT5KXSZCA,AHJFXFGDAXEHIG2ZLUWVMZ3LWPBA,AEP4CW3UI7AJ7XM7PAAKVCB6U3ZA,AHIWCPCQ2Z4HWEM7V4HGTLVZQM6Q,AHT4JDEYWRIQGCA2WAQJ6E2POHCQ","Works,Nice Product,Fast Charging as original,Good for data transfer,Average. Cost effective,Good quality,Great Product,Nice","Definitely isn’t as good as the original cord but works. Fast charging and pretty sturdy,Worth it,So I had a faulty cable. I was lazy and have a lot of money so instead of calling Apple I bought this for like 300 bucks. Didn’t expected much but for my surprise, this cable actually works and has fast charging. JUST GO FOR IT,Felt quite sturdy, the connectors look premium and were easy to insert. I used this cable to switch all my data from iphone 7 to an m30s. Cable worked like charm while using smart switch app, all my data including whatsapp data was transferred successfully. Satisfied with performance.,Just good,Quality is very goodWorking smoothly.. using same portronics pd charger,This is a real fast charging cable that is serving the purpose,Very good",4
B09KLVMZ3B,"AF2XXVO7JUBUVAOBTJ3MNH4DGUFQ,AH6VDJLLPBXKCWXMLBKMBCQ2ESGA,AE642RIGZIT2VPQJOLNUZ34QVWJQ,AFLHNKQH5UQZU3ATISKSMRE2KEDQ,AF2L4MCRCIDOOREQJN7QPQ4QBZCA,AGKLZ4SUHAU47KJXDVHBBEWJODUA,AHESCOYXLCXB56F4JO45X4CZQCYA,AGGHDE6KFZHEDUDJBD5R27AYMEWA","Great but,Worked well for 6 six months that’s it,Compatible with Apple iPad 2nd generation and charging very well.,CABLE,The product is good but the phone gets disconnected at multiple occasions.,Not a fast charging cable,Good item. Value,Amazing product and value for money","Loosing charging cable of apple is costly affair. This wire was great purchase made to correct it,Worked well for six months that’s it, now it’s stopped working, now planning to buy one more because the price has come down to 150,Very good product. Compatible with  iPad 2nd generation  and charging very well. Quality of the product is very good and also works fine. Totally worth for its price.,Product is super,I'm using from last 6 month. Till now it was good functioning. Now I noticed phone gets disconnected at multiple occasions. might be cable may be damaged.Overall worked well for 6 month.,Takes 5-6 hours to charge full.,Good item. Value,It is the best product I have used till now.",3
B083342NKJ,"AGSGSRTEZBQY64WO2HKQTV7TWFSA,AEYD5HVYAJ23CR6PTWOOIKUOIDHA,AFRMNW6TDHDZBP2UHF2K3MEAEYUA,AHICHCW6EC3BNV2IDAEAJPBG4HZQ,AGWFKE7RNP6EVC4JFLFSL76EEVVQ,AGEOQQHGNELZNEUKJAJUA7NTPBLA,AFS3QBSOMCE2FAZFUYZ3NBFQDLMQ,AGJYG6ZWCWD74WNE6Y37XZ2VUSMA","Good product,using this product 8months It is done  I have not faced any problem so far, its build quality best,I really liked this one.,Very strong and support fast charging ,,Nice cable,Best data cable charging fast,Good job,Good but need some improvement","I like it 👍👍,Best charging power . I used this cable on note 8 pro mi. Using 8month also fast working.,350 might be a little expensive but physically it’s so good. Feels premium. But power limitation is there it is not suitable for fast charging.,,https://m.media-amazon.com/images/W/WEBP_402378-T1/images/I/61WnvIUaIwL._SY88.jpg,Best data cable charging fast,Very good quality and good durability,Overall good but need some improvement...",1
B0B6F7LX4C,"AHEVOQADJSSRX7DS325HSFLMP7VQ,AG7XYZRCSKX6G2OLO7DVZWIZ3PUQ,AE2THTCCQLBIUSWPF4CPXC6GGP7Q,AHUJZOV34DFEN55QQ5XOYKVKHV6Q,AELX4DI77ZHURZTDLYFU7XMP7R6Q,AE2ODWBBOBD2SITDDIEJ644OSRFQ,AFLW4WXYQ3G6HU5LBQORDDZO3FOQ,AGGRC2P6M43GDEWCAHGYAILCSKTQ","It is the best tv if you are getting it in 10-12k,Good price but the OS lags,GARBAGE QUALITY,Good product.,Good quality,Great experience everything is fantastic 🤠,Super picture quality and sound quality,Awesome","Pros- xiomi 5a is best in budget-Nice picture quality-Very nice audio output- Full of featureCONS- sometimes tv lags-Sometimes stucksIn this prize range all tv having cons like this.::Overall nice tv,The product in this price range is good but as it is running in Android 12 it lags. I hope after few updates the lags problem will be resolved,Useless product and useless quality. Display issues within 7 months and service center is not upto the mark. Go for better brands where quality is assured. I would wish if there was option of negative stars.,Uses as connectes TV the picture is very good. I was hopping a best level of song. Globaly it is a good product.,https://m.media-amazon.com/images/I/61spXDbojZL._SY88.jpg,Greater then ever,Good quality,Good 👍",5
B082LSVT4B,"AECPFYFQVRUWC3KGNLJIOREFP5LQ,AGYYVPDD7YG7FYNBXNGXZJT525AQ,AHONIZU3ICIEHQIGQ6R2VFRSBXOQ,AFPHD2CRPDZMWMBL7WXRSVYWS5JA,AEZ346GX3HJ4O4XNRPHCNHXQURMQ,AEPSWFPNECKO34PUC7I56ITGXR6Q,AHWVEHR5DYLVFTO2KF3IZATFQSWQ,AH4QT33M55677I7ISQOAKEQWACYQ","A Good Braided Cable for Your Type C Device,Good quality product from ambrane,Super cable,As,Good quality,Good product,its good,Good quality for the price but one issue with my unit","I ordered this cable to connect my phone to Android Auto of car. The cable is really strong and the connection ports are really well made. I already has a Micro USB cable from Ambrane and it's still in good shape. I connected my phone to the car using the cable and it got connected well and no issues. I also connected it to the charging port and yes it has Fast Charging support.,It quality is good at this price and the main thing is that i didn't ever thought that this cable will be so long it's good one and charging power is too good and also supports fast charging,Value for money, with extra length👍,Good, working fine,Product quality is good,Good,very good,Bought for my daughter's old phone.Brand new cable it was not charging, I already repacked and requested for replacement.I checked again, and there was some green colour paste/fungus inside the micro USB connector. I cleaned with an alcoholic and starts working again.Checked the ampere of charging speed got around 1400ma-1500ma - not bad, came with braided 1.5m long cable, pretty impressive for the price.Can't blame the manufacturer.But quality issues by the distributor, they might have stored in very humid place.",5
B08WRBG3XW,"AFB5KJR4Q5FICAHBOPDPUTB3O7QQ,AHW3QBHDOUMXODZ4EAMHD5JMDIDQ,AGXRGH7DLS3RVFS5KWU4PGR3H3GQ,AFLIHOX2HH7S2OJAD63UAHKMY34Q,AEHBE4U3HD6G2TMSHKE7TNZYOWCA,AFHKIURZM4R62UEXTOCZLI2FPQ6A,AEW6K4E5A4RUWRFFUDINQE5WWBSQ,AG4LMDCRAAKD4U2FZ6B6N75KTHXA","Good for charging and Data transfer,ਮਜ਼ਬੂਤ,Good Quality but less Power Delivery,Fantastic!,Good,Not useful,Doesn't fit properly,Can't support Oppo mobile for fast charging","Check for offera before buying,18w charging cable,,Awesome cable!Charging, data transfer and durability is simply awesome, and there is not a single disconnection issue, which I always faced in original mi cable from box. Bought 1 more time as last cable damaged when phone fell on usb cable port as my phone is heavy and I never faced any issues so i bought one more time and didn't went for replacement as its waste of time and energy, i also have boat earphones that is also awesome..😄,Good,Charging is very slow. Forget about fast charging. Not useful at all,Cable is not fit properly on my samsung galaxy m31 type C port. If little hit happens then cable is plug it out. Otherwise length and cable quality is very nice,Boat type C cable doesn't support fast charging on Oppo F15, earlier i was using Vooc cable, which worked excellent",5
B08DPLCM6T,"AHBNKB74LGTYUOKPAJBSKNFV45CA,AFIECTV45ADX5YPTE2VU6ORRHTGQ,AFDUJI7KG7VMZF4JGJHV4DBCA4OA,AEUWKSX5ZL7DWOOYVDOWJKBHOVXA,AHEJW5MYVFOQBEXD6BIUBB3PJBPQ,AEM2Y22BKLFYL5BK7SC56Q75ODOQ,AHWDVB4OO4S3YS5RYQZIDBNV6BUQ,AFCEDQXVCB4LUUBWXRJS6KRU62FQ","Sound quality,Very nice,Value for money,Good,Good for its price.,Good item,Budget friendly,Good","LG was always Good , correct delivery, good service but sound quality was poor. The speakers were fitted below the tv. No clear sound. That was the only problem.,Good videoGood vice,Picture quality is awesome.,Good at that price,Okay product, the OS has lags after about a year of use. This is the best you can get for the price tag it comes with.,I like it,Best one when it comes to bugdet, easy installation and handy features.,Good",4
B09C6HXFC1,"AFNYIBWKJLJQKY4BGK77ZOTVMORA,AFCTNNMP2LZLY5466YJ5AY3JE5ZA,AG3XBWOAL65DJSBHJ7LQ2K54HJKQ,AF2ZFMLJS4UBCGZO4FMJTEPP6MHA,AFBZMRHC4GXUU7KNAK4OBKORDF6Q,AHSIQL276K7X2UP72QOOOWNVRSXA,AF3D6X5NQWOBOEVVH2Y37N55AKZQ,AFWOTSQXCQJLZ653Y7ACEZADKGYQ","Good cable for car,Good substitute for orginal,Better Value for money Product,Way better than the original,Absolutely amazing.,Namm hi kafi hai,Very good,As the names say Durable cell it a durable cable ;-)","I trust this product! Works well with car play!,Very good quality and charging is fine. As good as original,Build quality is awesome, best lightening cable ever seen, better than a official  lightening from If ur looking for a cable close your eyes and go for it 🔥 or you can buy a (Amazon basics) one I was using that for past 3 years that a bit a cheaper side, I recommend both these cables had better build quality and value for money,Gr8 product overall,Just loved it, very good charging speed.,,Good quality,it well packed, all sealed coveredthe wire looks of a very good qualityrecommended!!!!",4
